{
  "verdict": "APPROVE",
  "confidence": "high",
  "strategic_assessment": "After two REVISE cycles, v3 pins falsification (x64 off/on), names a single Tier A code target (spread_charges accumulation dtype), uses policy-numeric P2a-B2-R for dynamics gates, reuses tip3p_ke_compare jax_meta shape, and sequences SHA-paired verification. Remaining items are suggestion-level (main() config timing, env/CLI consistency, Epic C fallback).",
  "concerns": [
    {
      "area": "JAX config timing",
      "severity": "suggestion",
      "issue": "jax.config.update must run in main() after parse_args before JIT, not only after bare import jax.",
      "recommendation": "State explicitly in the implementation PR and Slurm docs."
    },
    {
      "area": "Env vs CLI",
      "severity": "suggestion",
      "issue": "JAX_ENABLE_X64 and --jax-x64 could disagree.",
      "recommendation": "Log both requested paths in jax block; pick one blessed Slurm pattern."
    },
    {
      "area": "tip3p_ke_profile",
      "severity": "suggestion",
      "issue": "Forward-compat if that module ever imports JAX before config.",
      "recommendation": "CI grep or comment guard."
    }
  ],
  "approved_for_execution": true
}
