{
  "verdict": "APPROVE",
  "confidence": "high",
  "strategic_assessment": "The revised handoff plan perfectly captures the user's requirements, including the Typer CLI, specific dependency management, and detailed scripts for weight conversion.",
  "concerns": [],
  "approved_for_execution": true
}
