{
  "verdict": "REVISE",
  "confidence": "high",
  "strategic_assessment": "The plan is architecturally sound on SETTLE integration and correctly resolved the VLIMIT purity concern from Cycle 2. However, it contains two factual errors that would cause implementation bugs: (1) the mask_elec → GB substitute claim is numerically incorrect because exclusion_mask is binary but mask_elec carries fractional 1-4 scales, and (2) the plan does not specify how run_simulation will obtain water_indices since Protein objects lack this field — only MergedTopology carries it. Additionally, the plan proposes creating a new settle_rattle_langevin in physics/simulate.py but settle.py already contains a complete settle_langevin BAOAB integrator that could be extended, creating unnecessary code duplication.",
  "concerns": [
    {
      "area": "GB Mask Mapping: mask_elec vs exclusion_mask",
      "severity": "critical",
      "issue": "The plan claims mask_elec from compute_exclusion_mask_neighbor_list 'perfectly recovers the standard O(N^2) exclusion_mask parity'. This is wrong. exclusion_mask (system.py:329) is binary: (mat_vdw > 0.0).astype(float32), yielding 0.0 for 1-2/1-3 and 1.0 for 1-4 and normal pairs. But mask_elec returns fractional scales: 0.0 for 1-2/1-3, scale_14_elec (~0.833) for 1-4, and 1.0 for normal pairs. Using mask_elec as pair_mask_born would incorrectly attenuate GB Born radii contributions from 1-4 pairs by ~17%.",
      "recommendation": "Use mask_hard (not mask_elec) as the sparse replacement for pair_mask_born and pair_mask_energy in the else branch (system.py:451-453). mask_hard is binary (0.0 for fully-excluded 1-2/1-3, 1.0 for everything else including 1-4), which exactly matches the semantics of the current exclusion_mask. When scale_matrix_vdw is not None (the common ExclusionSpec path), the code already sets gb_mask = jnp.ones_like(...), so no NL optimization is needed there — the O(N^2) issue only matters in the fallback else branch."
    },
    {
      "area": "water_indices Access Path",
      "severity": "critical",
      "issue": "The plan says 'In run_simulation, extract water_indices if available' but Protein (proxide.core.containers) has no water_indices field — verified by grep. Only MergedTopology (topology_merger.py:50) carries water_indices. run_simulation currently normalizes all inputs into a Protein object (simulate.py:459). The plan does not specify how water_indices flows from MergedTopology through to the integrator dispatch point at line 817.",
      "recommendation": "Specify one of: (a) run_simulation gains a MergedTopology input path and extracts water_indices from it, (b) SimulationSpec gains water_indices: Array | None = None as a user-provided override, or (c) run_simulation probes getattr(protein_system, 'water_indices', None) and MergedTopology is duck-typed as a Protein since it carries all required fields. Option (c) is simplest given MergedTopology already has charges, bonds, masses, etc."
    },
    {
      "area": "Integrator Duplication",
      "severity": "warning",
      "issue": "settle.py already contains a complete BAOAB settle_langevin integrator (lines 410-527) with init_fn/apply_fn that mirrors rattle_langevin in physics/simulate.py. The plan proposes adding settle_rattle_langevin in physics/simulate.py — a third integrator duplicating BAOAB logic from both existing implementations.",
      "recommendation": "Extend the existing settle_langevin in settle.py to accept optional constraints: tuple[Array, Array] | None for solute RATTLE, composing both constraint types in a single integrator. This keeps all SETTLE logic collocated in settle.py and avoids a third BAOAB copy. The dispatch in simulate.py would call settle.settle_langevin(..., constraints=solute_constraints)."
    },
    {
      "area": "Verification Plan Gaps",
      "severity": "suggestion",
      "issue": "The verification plan lists test_electrostatic_methods_openmm.py and test_openmm_explicit_anchor.py but neither tests SETTLE integration into the production runner. There is an existing tests/physics/test_settle.py that is not mentioned. No new test is proposed for the combined SETTLE+RATTLE path or for the production run_simulation(..., rigid_water=True) round-trip.",
      "recommendation": "Add to the verification plan: (1) run existing test_settle.py, (2) create a new integration test test_settle_rattle_combined.py that runs 100 steps of a small solvated system with both SETTLE and solute RATTLE active, verifying water geometry and protein bond lengths are maintained."
    }
  ],
  "approved_for_execution": false
}
