{
  "verdict": "REVISE",
  "confidence": "high",
  "strategic_assessment": "v1.88 makes significant progress by incorporating the unified bandwidth-throughput audit and partial ECC event metadata. However, it fails on nomenclature precision for the B-Spline invariance compound term and retains fragments of deprecated/incorrect nomenclature and logic in both the ECC manifest and the PME validation suite. The logic for isolating magnitude from sign-coupling remains partially contaminated with incorrect coordinate mappings.",
  "concerns": [
    {
      "area": "PME Implementation Specificity (Section 2.1 P1b)",
      "severity": "critical",
      "issue": "The compound term for B-Spline invariance is split into separate entries and missing the unified 'Sign Magnitude' suffix. v1.88 uses 'Position Magnitude' instead of the unified 'Position Sign Magnitude'.",
      "recommendation": "Unify the term to 'B-Spline Grid-Summing Invariance to Particle Velocity Magnitude Direction Sign Position Sign Magnitude'."
    },
    {
      "area": "B-Spline Verification Logic (Section 2.1 P1b)",
      "severity": "critical",
      "issue": "The verification logic still references 'x vs 2x', which was explicitly flagged as incorrect. The mandate is to use '-x vs -2x' to isolate magnitude from sign-coupling.",
      "recommendation": "Replace 'evaluating a particle at coordinate x vs 2x (and -x vs -2x)' with 'evaluating a particle at coordinate -x vs -2x' to strictly isolate spatial-magnitude-scaling from coordinate sign-couplings."
    },
    {
      "area": "Metadata Integrity (Section 2.1 P1h)",
      "severity": "warning",
      "issue": "One manifest entry 'System GPU-Memory ECC Correction Reason Status Timestamp Volume PSD Map' still omits the 'Event' keyword, despite the keyword being added to other entries in the same list.",
      "recommendation": "Ensure all ECC manifest entries use the 'Event' keyword; specifically, rename the aforementioned entry to 'System GPU-Memory ECC Correction Event Reason Status Timestamp Volume PSD Map'."
    },
    {
      "area": "Computational Resource Efficiency (Section 2.4)",
      "severity": "warning",
      "issue": "v1.88 retains the entry 'Kernel-Level Global-Memory-Throughput-Stability-Volume Audit' without the required 'Bandwidth' component in the unified term.",
      "recommendation": "Rename all instances of the throughput-only audit to the unified 'Kernel-Level Global-Memory-Bandwidth-Throughput-Stability-Volume Audit'."
    }
  ],
  "approved_for_execution": false
}