{
  "verdict": "REVISE",
  "confidence": "high",
  "strategic_assessment": "The Explicit Solvent Validation Plan (v1.72) is exceptionally mature, incorporating all 68 previous cycles of recommendations. However, it fails to explicitly integrate the specific new requirements for Cycle 69, particularly regarding instruction-issue-rate stability, bus-clock change reasons, velocity direction invariance, and the unified 10D visualization for the pressure tensor kurtosis map.",
  "concerns": [
    {
      "area": "Computational Resource Efficiency",
      "severity": "warning",
      "issue": "The plan does not specify a 'Kernel-Level Instruction-Issue-Rate-Stability Sphericity Audit'. While it includes an 'Instruction-Latency-Stability' audit with jax.profiler/5% details, and a separate 'Instruction-Issue-Rate Temporal Sphericity Audit', it misses the specific combined requirement for the PME Reciprocal sum kernel.",
      "recommendation": "Update Section 2.4 to explicitly mandate a 'Kernel-Level Instruction-Issue-Rate-Stability Sphericity Audit' using jax.profiler to verify isotropic and stable (within 5%) issue rates for the PME Reciprocal sum kernel."
    },
    {
      "area": "Metadata Integrity",
      "severity": "warning",
      "issue": "The reference manifest requirement includes 'System GPU-Memory Bus-Clock Status Change Log' but lacks the 'Reason Log' (e.g., Slurm power-capping) specified in Cycle 69 focus.",
      "recommendation": "Amend Section 2.1 (P1h) to include 'System GPU-Memory Bus-Clock Status Change Reason Log' to correlate noise with energy policies."
    },
    {
      "area": "PME Implementation Specificity",
      "severity": "warning",
      "issue": "The plan lacks the 'B-Spline Grid-Summing Invariance to Particle Velocity Direction' validation. It mentions velocity and velocity magnitude, but not the specific direction check (+v vs -v) with bitwise identical grid weight requirements (1e-12).",
      "recommendation": "Add 'B-Spline Grid-Summing Invariance to Particle Velocity Direction' to Section 2.1 (P1b), requiring bitwise identical weights (within 1e-12) for velocities +v and -v at fixed speed."
    },
    {
      "area": "Finality Evidence",
      "severity": "suggestion",
      "issue": "The 'Pressure Tensor Kurtosis Sphericity Temporal PSD Volume Temporal Sphericity Temporal PSD Map' is listed, but lacks the explicit '(10D)' designation and the unified visualization description (kurtosis density + orientation + frequency + etc.) provided in the Cycle 69 focus.",
      "recommendation": "Append '(10D)' to the Pressure Tensor Kurtosis map in Section 2.4 and include the unified visualization description to ensure comprehensive finality evidence."
    }
  ],
  "approved_for_execution": false
}
