{
  "verdict": "REVISE",
  "confidence": "high",
  "strategic_assessment": "v1.11 successfully addresses Cycles 7-8 focus areas but lacks the operational resilience (Failure Recovery) and developmental efficiency (Parallelization) required for Cycle 9. The plan is physically sound but operationally fragile.",
  "concerns": [
    {
      "area": "Parallelization Efficiency",
      "severity": "warning",
      "issue": "Roadmap is purely sequential (Section 3).",
      "recommendation": "Overlap Phase 2 and Phase 3 to compress the 10-week timeline."
    },
    {
      "area": "Failure Recovery",
      "severity": "critical",
      "issue": "No 'Disaster Recovery' protocol for the Golden Set in Git LFS.",
      "recommendation": "Define redundant storage and manifest restoration procedures in P1h."
    },
    {
      "area": "PME Grid Sensitivity",
      "severity": "warning",
      "issue": "Strategy for 1.0Å grid spacing is heuristic; no requirement to verify convergence.",
      "recommendation": "Add a task to P1b to plot the 'Energy vs. Grid Resolution' curve to ensure convergence."
    },
    {
      "area": "Residue Diversity",
      "severity": "warning",
      "issue": "Disulfide Bonds (CYS-CYS) are excluded from residue diversity targets.",
      "recommendation": "Add Disulfide Bond Parity to P1i or a new P1j to verify cross-residue bond exclusion logic."
    }
  ],
  "approved_for_execution": false
}
