{
  "verdict": "REVISE",
  "confidence": "high",
  "strategic_assessment": "The Explicit Solvent Validation Plan (v1.82) is highly rigorous but fails to meet the specific requirements of the 78th cycle. It lacks the critical Volume-dimension audits for instruction reuse, frequency-domain metadata for bus-width transitions, and the 15D finality visualization for force vector divergence.",
  "concerns": [
    {
      "area": "Computational Resource Efficiency",
      "severity": "critical",
      "issue": "The plan specifies a 'Kernel-Level Instruction-Reuse-Throughput-Stability Sphericity Audit' but omits the required 'Volume' dimension. It does not verify that instruction-reuse-throughput is spatially uniform across 3D SM-clusters within 5%.",
      "recommendation": "Replace the 'Sphericity Audit' with a 'Kernel-Level Instruction-Reuse-Throughput-Stability-Volume Audit' and specify the use of jax.profiler to verify isotropic throughput across SMs and spatial uniformity across 3D SM-clusters."
    },
    {
      "area": "Metadata Integrity",
      "severity": "critical",
      "issue": "The reference manifest (P1h) includes 'System GPU-Memory Bus-Clock Status Change Reason Timestamp Volume PSD Map' but lacks the 'Bus-Width' equivalent. Bus-width transitions must be mapped with frequency spectral density to correlate timing jitter with hardware events.",
      "recommendation": "Add 'System GPU-Memory Bus-Width Status Change Reason Timestamp Volume PSD Map' to the reference manifest requirements in Section 2.1 (P1h)."
    },
    {
      "area": "PME Implementation Specificity",
      "severity": "warning",
      "issue": "The validation of 'B-Spline Grid-Summing Invariance to Particle Velocity Magnitude Direction Sign Position' (P1b) is mentioned but lacks the specific bitwise identity requirement for speed 2v vs v. The existing description focuses on charge/sign coupling instead of magnitude-scaling isolation.",
      "recommendation": "Update Section 2.1 (P1b) to explicitly require bitwise identity (within 1e-12) for evaluations with speed 2v and v at the same coordinate and direction."
    },
    {
      "area": "Finality Evidence",
      "severity": "critical",
      "issue": "The Validation Certificate includes a 14D map for Force Vector Divergence, but missing the 15th dimension (Temporal Convergence). A 'Force Vector Divergence Kurtosis Sphericity Temporal PSD Volume Temporal Sphericity Temporal PSD Volume Temporal Convergence Map' is required to prove force resonance decay.",
      "recommendation": "Upgrade the 'Force Vector Divergence' map in Section 2.4 from 14D to a 15D 'Convergence Map' that includes documented convergence rates."
    }
  ],
  "approved_for_execution": false
}
