{
  "verdict": "REVISE",
  "confidence": "high",
  "strategic_assessment": "Version 1.8 has successfully integrated Cycle 5 requirements, including formal gates and manifests. However, the plan is still insufficient in defining numerical error partitioning and stress-testing under non-standard conditions.",
  "concerns": [
    {
      "area": "Error Budget Allocation",
      "severity": "warning",
      "issue": "The 1e-3 relative error budget for float32 is global and not partitioned between components (e.g., PME vs Bonded). This masks component-level inaccuracies.",
      "recommendation": "Partition the 1e-3 float32 budget into explicit sub-allocations (e.g., PME Reciprocal < 5e-4, Bonded < 2e-4, Constraints < 1e-4) to ensure granular integrity."
    },
    {
      "area": "Stress Testing",
      "severity": "warning",
      "issue": "The plan relies exclusively on standard conditions (1UAO at 300K). It lacks extreme system tests like high temperature or non-neutral total charge to verify numerical robustness.",
      "recommendation": "Add a 'Robustness' target to Phase 4 that includes a 400K stability check and a net-charged system parity test."
    },
    {
      "area": "API Stability",
      "severity": "warning",
      "issue": "PMEConfig lacks a versioning strategy. Future changes to the configuration schema could break the validation history or cause silent parity failures.",
      "recommendation": "Include a versioning field in the PMEConfig specification to ensure backward compatibility and explicit validation artifact management."
    },
    {
      "area": "Maintenance Automation",
      "severity": "suggestion",
      "issue": "The plan mentions daily force parity runs but doesn't explicitly define a comprehensive nightly regression suite for all phases against the Golden Set.",
      "recommendation": "Formally add a 'Nightly Regression Suite' task to Phase 4 that compares all energy, force, and dynamic metrics against the SHA-256 manifest."
    }
  ],
  "approved_for_execution": false
}
