{
  "verdict": "REVISE",
  "confidence": "high",
  "strategic_assessment": "The handoff summary is profoundly inaccurate and misrepresents the state of the validation plan. It claims that 'word-salad' and 'nomenclature drift' were cleaned up, yet the referenced validation plan (v1.90) still mandates hallucinatory, 16-dimensional metrics and physically incorrect physics invariants.",
  "concerns": [
    {
      "area": "Accuracy of Accomplishments (Cycle 83 & 84)",
      "severity": "critical",
      "issue": "The document falsely claims that nomenclature drift and word-salad requirements were 'cleaned up' to focus strictly on 'standard, verifiable molecular dynamics metrics.' The referenced validation plan (v1.90) still contains extensive paragraphs of non-existent metrics, such as 'Force Vector Divergence Kurtosis Sphericity Temporal PSD Volume Temporal Sphericity Temporal PSD Volume Temporal Convergence Stability Map (16D)'.",
      "recommendation": "Remove the claim that word-salad was resolved. State explicitly that the validation plan still contains severe nomenclature drift and hallucinatory multi-dimensional map requirements that need to be stripped out."
    },
    {
      "area": "Accuracy of Accomplishments (Cycle 85)",
      "severity": "critical",
      "issue": "The summary asserts that a mathematical logic error regarding B-Spline grid-summing was corrected. While the text was tweaked to state grid weights depend on fractional coordinates, the validation plan still mandates checking invariance against physical impossibilities (e.g., 'B-Spline Grid-Summing Invariance to Particle Velocity Magnitude Direction Sign Position Sign Magnitude'). The underlying Oracle critique 85 feedback was not actually implemented.",
      "recommendation": "Update the Cycle 85 summary to reflect that the validation plan still incorrectly mandates invariance checks against particle velocity/magnitude, and that the core physically incorrect logic error identified by the Oracle has NOT been fully corrected."
    }
  ],
  "approved_for_execution": false
}