{
    "verdict": "APPROVE",
    "confidence": "high",
    "strategic_assessment": "The handoff document is highly accurate, concise, and clear. It perfectly captures the current objective of securing Oracle approval, and critically details the specific remaining physical hallucinations (e.g., 16D convergence maps) and nomenclature drift in the validation plan. This provides excellent context for the next iteration.",
    "concerns": [],
    "approved_for_execution": true
}