{
  "verdict": "REVISE",
  "confidence": "high",
  "strategic_assessment": "The Explicit Solvent Validation Plan (v1.74) remains robust in its core methodology but fails all four new focus criteria for Cycle 71. Significant metadata and PME-specific validation gaps must be closed before final approval.",
  "concerns": [
    {
      "area": "Computational Resource Efficiency (Part 50)",
      "severity": "critical",
      "issue": "Plan misses 'Kernel-Level Instruction-Reuse-Stability Sphericity Audit' for PME Reciprocal sum kernel.",
      "recommendation": "Add a mandate for a Kernel-Level Instruction-Reuse-Stability Sphericity Audit (via jax.profiler) to verify isotropic instruction-reuse rate (stable within 5%) across SMs."
    },
    {
      "area": "Metadata Integrity (Part 57)",
      "severity": "warning",
      "issue": "'reference_manifest.json' lacks unified 'System GPU-Memory Bus-Clock Status Change Reason Timestamp Log'. Current logs for timestamp and reason are separate, hindering direct jitter-to-event correlation.",
      "recommendation": "Replace separate logs with a unified 'System GPU-Memory Bus-Clock Status Change Reason Timestamp Log' capturing exact time and reason in a single entry."
    },
    {
      "area": "PME Implementation Specificity (Part 57)",
      "severity": "critical",
      "issue": "Missing validation for 'B-Spline Grid-Summing Invariance to Particle Position Sign'.",
      "recommendation": "Include a validation step verifying that particles at +x vs -x produce bitwise identical grid weights (within 1e-12) after boundary wrapping."
    },
    {
      "area": "Finality Evidence (Part 53)",
      "severity": "warning",
      "issue": "Pressure Tensor Kurtosis Sphericity Temporal PSD Volume Temporal Sphericity Temporal PSD Map is labeled as 10D and lacks the final 'Temporal' component.",
      "recommendation": "Update to 'Pressure Tensor Kurtosis Sphericity Temporal PSD Volume Temporal Sphericity Temporal PSD Temporal Map' and correctly classify it as a unified 11D visualization."
    }
  ],
  "approved_for_execution": false
}