{
  "verdict": "REVISE",
  "confidence": "high",
  "strategic_assessment": "The Explicit Solvent Validation Plan (v1.79) is a highly mature document, effectively incorporating complex physical and hardware audits. However, it exhibits four specific technical omissions and dimensional mismatches in the Cycle 75 criteria, necessitating a revision to achieve full compliance with the current multi-axis critique requirements.",
  "concerns": [
    {
      "area": "Computational Resource Efficiency",
      "severity": "warning",
      "issue": "The 'Kernel-Level Global-Memory-Bandwidth-Utilization-Stability Sphericity Audit' (L54) is listed without specifying the required implementation tools and thresholds (jax.profiler, isotropic across memory-controllers, stable over time, and spatially uniform within 5%).",
      "recommendation": "Update the audit requirement to explicitly mandate the use of `jax.profiler` to verify that the PME Reciprocal sum kernel achieves a global-memory-bandwidth-utilization that is isotropic across all memory-controllers, stable over time, and spatially uniform across SM-clusters within 5%."
    },
    {
      "area": "Metadata Integrity",
      "severity": "warning",
      "issue": "The `reference_manifest.json` specification (L22) includes 'System GPU-Memory Bus-Clock Status Change Reason Timestamp Map' but omits the required 'Volume Map' component requested for the 75th critique.",
      "recommendation": "Incorporate the 'System GPU-Memory Bus-Clock Status Change Reason Timestamp Volume Map' into the reference manifest requirement to ensure full spatial correlation of bus-clock transitions."
    },
    {
      "area": "Finality Evidence (Pressure Tensor)",
      "severity": "warning",
      "issue": "The 'Validation Certificate' requirement (L55) specifies a 13D 'Pressure Tensor Kurtosis Sphericity Temporal PSD Volume Temporal Sphericity Temporal PSD Volume Map', which lacks the final 14th dimension (Temporal) required for the unified visualization of stress resonance peaks.",
      "recommendation": "Upgrade the requirement to a 'Pressure Tensor Kurtosis Sphericity Temporal PSD Volume Temporal Sphericity Temporal PSD Volume Temporal Map' (14D) as per the Part 58 specifications."
    },
    {
      "area": "Dimensionality Consistency (Force Vector)",
      "severity": "suggestion",
      "issue": "The plan lists both a 12D and a 13D Force Vector Divergence map. While the 13D version is present (satisfying previous recommendations), the inclusion of the 12D version (L55) creates ambiguity and potential redundancy.",
      "recommendation": "Remove the redundant 12D Force Vector Divergence map reference from the Validation Certificate section to maintain high-signal fidelity."
    }
  ],
  "approved_for_execution": false
}