{
  "verdict": "REVISE",
  "confidence": "high",
  "strategic_assessment": "The v1.85 plan successfully integrates the 80th cycle's recommendations but fails to meet the specific requirements of the 81st critique focus, particularly regarding bandwidth-level kernel audits, ECC event metadata nomenclature, charge-velocity coupling invariance in PME, and the 16D stability convergence map extension.",
  "concerns": [
    {
      "area": "Computational Resource Efficiency (Part 55)",
      "severity": "warning",
      "issue": "The plan specifies a 'Kernel-Level Instruction-Latency-Throughput-Stability-Volume Audit' (which focuses on latency-throughput and SM-clusters), but lacks the required 'Instruction-Throughput-Bandwidth-Stability-Volume Audit' focusing on 'throughput-bandwidth' that is isotropic across SMs and stable over time.",
      "recommendation": "Update section 2.4 to require a '**Kernel-Level Instruction-Throughput-Bandwidth-Stability-Volume Audit**' to verify that the PME Reciprocal sum kernel achieves an integrated throughput-bandwidth that is isotropic across SMs and stable over time, while remaining spatially uniform across SM-clusters within 5%."
    },
    {
      "area": "Metadata Integrity (Part 68)",
      "severity": "suggestion",
      "issue": "The plan uses the term 'System GPU-Memory ECC Correction Reason Timestamp Volume PSD Map' in section 2.1 P1h, which does not match the required nomenclature 'System GPU-Memory ECC Correction Event PSD Map' and omits the requirement for jitter correlation with hardware-level interference patterns.",
      "recommendation": "Rename the manifest requirement to '**System GPU-Memory ECC Correction Event PSD Map**' and specify that recording the frequency spectral density of every ECC correction event must ensure timing jitter correlation with periodic hardware-level interference patterns."
    },
    {
      "area": "PME implementation specificity (Part 68)",
      "severity": "critical",
      "issue": "The plan's B-Spline invariance validation in section 2.1 P1b relies on velocity-coordinate mapping (speed v at -x) but fails to address the charge-sign velocity-magnitude coupling (charge -q at x with speed 2v) specifically requested in Cycle 81 to isolate sign and magnitude couplings.",
      "recommendation": "Update the requirement to '**B-Spline Grid-Summing Invariance to Particle Charge-Sign Position Velocity Magnitude**' and specify verification that evaluating a particle with charge -q at x with speed 2v produces grid weights bitwise identical (within 1e-12) to evaluations with charge q at x with speed v."
    },
    {
      "area": "Finality Evidence (Part 64)",
      "severity": "warning",
      "issue": "The 'Validation Certificate' in section 2.4 includes a 'Force Vector Divergence ... Convergence Map (15D)', but omits the required 'Stability' suffix and the 16th dimension (Convergence Stability) requested for finality evidence.",
      "recommendation": "Extend the 15D map to a 16D '**Force Vector Divergence Kurtosis Sphericity Temporal PSD Volume Temporal Sphericity Temporal PSD Volume Temporal Convergence Stability Map**', and ensure the unified visualization includes documented convergence stability across all specified axes."
    }
  ],
  "approved_for_execution": false
}