{
  "verdict": "REVISE",
  "confidence": "high",
  "strategic_assessment": "Plan v1.48 successfully maintains previous audit requirements (Page-Table Walk, GPU Persistence, etc.) but fails to incorporate the specific higher-order validation metrics required for Cycle 46. While existing checks cover TLB hit rates and throttle reasons, they lack the temporal and prefetch-efficiency depth necessary for high-fidelity production validation.",
  "concerns": [
    {
      "area": "Computational Resource Efficiency",
      "severity": "critical",
      "issue": "Missing Kernel-Level TLB-Prefetch Efficiency Audit. The plan currently only specifies a TLB-Hit Rate Audit, which fails to quantify the hardware prefetcher's success in hiding latency (>50%) for neighbor list accesses.",
      "recommendation": "Add 'Kernel-Level TLB-Prefetch Efficiency Audit' to Section 2.4, specifying the use of jax.profiler to verify latency hiding >50% for NL distance-matrix accesses."
    },
    {
      "area": "Metadata Integrity",
      "severity": "critical",
      "issue": "Missing System GPU-Throttling Duration in reference manifest. While 'Throttle Reason' is present, cumulative duration is required to ensure benchmark wall-clock distributions are not skewed by transient thermal/power events.",
      "recommendation": "Update Section 2.1 (P1h) to explicitly include 'System GPU-Throttling Duration' in the reference manifest requirements."
    },
    {
      "area": "PME Implementation Specificity",
      "severity": "critical",
      "issue": "Incomplete B-Spline Grid-Subsampling Linearity validation. The current 'Grid-Summing Linearity' check does not specify the N/2 grid condition, which is critical for verifying aliasing and truncation consistency during reciprocal space evaluation.",
      "recommendation": "Refine Section 2.1 (P1b) to include 'B-Spline Grid-Subsampling Linearity', explicitly requiring bitwise identity (within 1e-12) between a two-particle system on grid N/2 and the sum of single-particle systems on the same grid."
    },
    {
      "area": "Finality Evidence",
      "severity": "critical",
      "issue": "Missing Force Vector Divergence Sphericity Temporal Map in Validation Certificate. Existing separate plots for sphericity and temporal evolution do not provide the 2D polar distribution evolution needed to detect solvent-driven grid-axis biasing.",
      "recommendation": "Add 'Force Vector Divergence Sphericity Temporal Map' (as a 2D histogram/polar evolution plot) to the Validation Certificate requirements in Section 2.4."
    }
  ],
  "approved_for_execution": false
}
