{
  "verdict": "REVISE",
  "confidence": "high",
  "strategic_assessment": "The Explicit Solvent Validation Plan (v1.23) successfully incorporates previous recommendations but fails to address the critical new focus areas for Cycle 21. Phase 3 remains incomplete (truncated), and systemic risks regarding data resiliency and mixed-precision parity are unmitigated.",
  "concerns": [
    {
      "area": "Validation Pipeline Resiliency",
      "severity": "critical",
      "issue": "The plan lacks a defined Rollback Protocol for the Golden Set. If a GPG-signed manifest update is found to contain a bug, there is no documented procedure to revert the Git LFS state without risking data loss or inconsistency.",
      "recommendation": "Incorporate a 'Rollback Protocol' in P1h or Phase 4. This should include mandatory tag-based snapshotting of Git LFS states and a validated recovery command (e.g., `just revert-golden-set <timestamp/tag>`)."
    },
    {
      "area": "Platform-Specific Optimization",
      "severity": "warning",
      "issue": "The FP16/BF16 Mixed Precision Boundary for PME Reciprocal sums is undefined. As future H100 benchmarks will likely leverage `bfloat16`, the lack of accepted wide-tolerances for parity will lead to unnecessary build failures.",
      "recommendation": "Explicitly define the FP16/BF16 boundary in P1b. Set a wide-tolerance parity threshold (e.g., 5e-3 relative error) for PME Reciprocal sums when running in mixed-precision modes on supported hardware."
    },
    {
      "area": "Virial/Pressure Precision",
      "severity": "critical",
      "issue": "P2c fails to address the Virial Contribution of the Neutralizing Background Charge. This omission will cause pressure parity failures in non-neutral systems (e.g., proteins with net charge).",
      "recommendation": "Add a specific requirement to P2c to validate the 'Virial Contribution of Neutralizing Background Charge' against OpenMM's `NonbondedForce` implementation for non-neutral cells."
    },
    {
      "area": "Physicist HITL Checklist",
      "severity": "suggestion",
      "issue": "The plan mentions a visual gallery but lacks a rigorous Physicist HITL (Human-In-The-Loop) requirement for Charge Density Grid Maps. Visual inspection of 2D slices is necessary to catch B-Spline interpolation artifacts that metrics might miss.",
      "recommendation": "Update P3f to include a 'Charge Density Grid Map Audit'. Require the generation and manual review of 2D density slices during the initial validation of any new grid resolution or interpolation order."
    },
    {
      "area": "Completeness",
      "severity": "warning",
      "issue": "Phase 3 (Trajectory & Statistical Parity) is currently truncated with '...' placeholders, making it impossible to fully audit the statistical validation strategy.",
      "recommendation": "Flush out the full P3x series (P3a-P3f) to ensure the KS-test and RDF peak position metrics are backed by concrete implementation steps."
    }
  ],
  "approved_for_execution": false
}
