{
  "verdict": "REVISE",
  "confidence": "high",
  "strategic_assessment": "The explicit_solvent_validation_comprehensive.md (v1.52) is an exceptionally detailed and robust plan, demonstrating high technical maturity and rigorous attention to hardware-level performance and numerical precision. However, it fails to incorporate several specific mandates for Cycle 50, particularly regarding kernel-level ILP metrics for Neighbor Lists, microcode mitigation tracking in metadata, and specific boundary interpolation symmetry checks. Revisions are required to reach the 'Finality' standard required for approval.",
  "concerns": [
    {
      "area": "Computational Resource Efficiency (NL ILP)",
      "severity": "warning",
      "issue": "Section 2.4 mentions a general 'Kernel-Level Instruction-Parallelism Audit,' but lacks the specific requirement for the Neighbor List gathering kernels to achieve an ILP > 3.0. This is critical for verifying H100 execution pipeline utilization during O(N*K) search.",
      "recommendation": "Amend the requirement in Section 2.4 to explicitly specify: 'Perform a Kernel-Level Instruction-Level-Parallelism (ILP) Audit for the Neighbor List gathering kernels (verifying ILP > 3.0 to ensure multiple execution-pipelines on the H100 are being utilized during the O(N*K) search).'"
    },
    {
      "area": "Metadata Integrity (CPU Mitigations)",
      "severity": "warning",
      "issue": "Section 2.1 (P1h) includes microcode versioning and feature flags but omits System CPU-Microcode Feature Mitigation Status. Tracking spectre_v2, meltdown, and l1tf state is necessary as these mitigations introduce non-deterministic pipeline stalls that can affect high-precision timing/performance benchmarks.",
      "recommendation": "Add 'System CPU-Microcode Feature Mitigation Status (recording state of spectre_v2, meltdown, and l1tf mitigations from /sys/devices/system/cpu/vulnerabilities/*)' to the reference manifest requirements in Section 2.1 (P1h)."
    },
    {
      "area": "PME Implementation Specificity (Boundary Symmetry)",
      "severity": "warning",
      "issue": "Section 2.1 (P1b) validates general B-Spline symmetry but lacks the specific check for B-Spline Grid-Boundary Interpolation Symmetry. Specifically, it needs to verify bitwise symmetry (within 1e-12) between positions L-epsilon and epsilon after grid-index wrapping.",
      "recommendation": "Add a requirement to Section 2.1 (P1b): 'Validate B-Spline Grid-Boundary Interpolation Symmetry, specifically verifying that interpolation weights for position L-epsilon are bitwise symmetric (within 1e-12) to position epsilon after accounting for grid-index wrapping.'"
    },
    {
      "area": "Finality Evidence (Skewness Temporal Map)",
      "severity": "warning",
      "issue": "The 'Validation Certificate' in Section 2.4 includes a 'Pressure Tensor Skewness Map' and 'Kurtosis Temporal Map,' but misses the Pressure Tensor Skewness Temporal Map. A 2D histogram of skewness evolution is required to verify the Gaussian nature of the stress-state distribution over the 10ns stability run.",
      "recommendation": "Explicitly add 'Pressure Tensor Skewness Temporal Map (2D histogram showing the evolution of pressure tensor skewness over the 10ns stability run)' to the Final Artifact list in Section 2.4."
    }
  ],
  "approved_for_execution": false
}
