{
  "verdict": "REVISE",
  "confidence": "high",
  "strategic_assessment": "The handoff plan is structurally sound but lacks critical specifics requested by the user and necessary for successful independent execution.",
  "concerns": [
    {
      "area": "CLI Interface",
      "severity": "critical",
      "issue": "The user explicitly requested a Typer-based CLI interface, which is entirely missing from the plan.",
      "recommendation": "Add a specific section detailing the `cli.py` implementation using Typer, including proposed commands (e.g., `infer`, `convert-weights`)."
    },
    {
      "area": "Dependencies",
      "severity": "warning",
      "issue": "The project scaffolding step `uv init --lib` does not mention adding the critical dependencies required for this port.",
      "recommendation": "Explicitly list the required dependencies to be added via `uv add` (e.g., `jax`, `equinox`, `typer`, `numpy`)."
    },
    {
      "area": "Weight Loading Strategy",
      "severity": "warning",
      "issue": "The `handoff.md` plan mentions weight loading strategy but lacks concrete artifact definitions for the conversion scripts.",
      "recommendation": "Specify a dedicated script `scripts/convert_weights.py` to handle the `.pt` to Equinox tree conversion."
    }
  ],
  "approved_for_execution": false
}
